{
  "name": "ai-board",
  "version": "1.0.0",
  "description": "AI-powered specification-driven development workflow automation",
  "author": {
    "name": "ai-board",
    "url": "https://github.com/ai-board/ai-board"
  },
  "repository": "https://github.com/ai-board/ai-board",
  "license": "MIT",
  "keywords": [
    "ai-development",
    "specification",
    "workflow",
    "automation",
    "code-generation"
  ]
}
